{
  "mode": "partner_search_batch",
  "question": "合成示例：逐月比较条件命中最多的假设生日，不是现实正缘预测",
  "self": {
    "birth": {"calendar":"solar","date":"1996-06-15","time":"12:00","gender":"male","timezone":"Asia/Shanghai"}
  },
  "as_of": "2026-10-08",
  "search": {
    "type": "dates",
    "start": "1997-06-01",
    "end": "1997-07-31",
    "timezone": "Asia/Shanghai",
    "time_uncertainty": {"type":"unknown"}
  },
  "ranking": "monthly_top",
  "candidate_year_branch": "丑",
  "filters": {
    "conditions": ["zodiac_affinity","spouse_branch_liuhe","day_stem_five_combine","partner_star_projection"],
    "match": "any",
    "year_gap": [-12,12]
  }
}
